제품명,설명
신선주 약주,충북무형문화재 제4호
52C,세계 최초의 오이 증류주
신선주 증류주,충북무형문화재 제4호
G12 골디락스,무첨가 프리미엄 탁주
지란지교 무화과 탁주,순창 건곡리의 구전비법 누룩과 주방문을 빌어 재현한 술
당당하리,홍마늘의 백리를 듬뿍 담은 지역 특산주
지란지교 탁주,순창 건곡리의 구전비법 누룩과 주방문을 빌어 재현한 술
백이주,마늘의 백리만 듬뿍 담은 지역전통주
지란지교 약주,순창 건곡리의 구전비법 누룩과 주방문을 빌어 재현한 술
배도가 로아 19 레드,한방울 한방울 천천히 내린 흰 빛깔의 이슬
추사백25,예산만의 지역적인 특성과 원료를 살린 사과 증류주
심플리 애플,우리쌀로 빚은 증류식 소주와 사과의 상큼한 만남
"코이버펑크, 머스캣 베일리 에이",자연주의 친환경 고품질 와인
맑은내일 Winery 단감명작,창녕 단감만의 달달한 한 모금
"코이버펑크, 샤르도네 세미용 블렌드",자연주의 친환경 고품질 와인
운암1945,
"코이버펑크, 카베르네 소비뇽",자연주의 친환경 고품질 와인
이도 32,세종대왕의 깊은 뜻을 담은 전통주
신선주 백주,충북무형문화재 제4호
33JU,"7년근 이상의 산양산삼을 3일 동안 고온과 저온 추출하여 3,333시간 숙성한 전통주"
젤코바 캠벨와인,유기농 캠벨포도로 빚은 자연주의 와인
바랑 탁,진한 감칠 맛에 쌀향이 가득 담긴 고순도 수제 탁주
별바랑,내추럴 와인같은 산미와 단맛을 지닌 수제 약주
대작 생막걸리,철원 오대쌀로 빚은 전통 막걸리
모월 인,"어머니와 같은, 달과 같은 넉넉하고 은은한 증류식소주"
모월 로,"어머니와 같은, 달과 같은 넉넉하고 은은한 증류식소주"
모월 청,"어머니와 같은, 달과 같은 넉넉하고 은은한 약주"
모월 연,"어머니와 같은, 달과 같은 넉넉하고 은은한 약주"
젤코바 스페셜와인,산머루로 빚은 경쾌한 느낌의 머루와인
젤코바 프리미엄와인,산머루로 빚은 프리미엄 머루와인
그랑꼬또 화이트와인,한국와인의 명가 그랑꼬또 와이너리에서 빚은 화이트와인
시나브로 화이트와인,나도 모르게 시나브로 반하게 만드는 매력적인 와인
시나브로 에뚜왈 로제 스파클링,나도 모르게 시나브로 반하게 만드는 매력적인 와인
시나브로 로제와인,나도 모르게 시나브로 반하게 만드는 매력적인 와인
포엠 레드 스위트와인,직접 재배한 유기농 포도로 빚은 품질 좋은 한국와인
포엠 레드 드라이와인,직접 재배한 유기농 포도와 머루로 빚은 품질 좋은 한국와인
포엠 로제와인,직접 재배한 유기농 포도로 빚은 품질 좋은 한국와인
포엠 화이트와인,직접 재배한 유기농 포도로 빚은 품질 좋은 한국와인
두레앙 22,대한민국 우리술품평회 3회 석권에 빛나는 증류주
그랑꼬또 M5610,한국와인의 명가 그랑꼬또 와이너리에서 빚은 로제와인
그랑꼬또 레드와인,한국와인의 명가 그랑꼬또 와이너리에서 빚은 레드와인
성포 생막걸리,거제도를 대표하는 36년 역사의 양조장에서 빚은 술
유자 동동주,거제도를 대표하는 36년 역사의 양조장에서 빚은 술
행운 막걸리,거제도를 대표하는 36년 역사의 양조장에서 빚은 술
행운주,
나루 생막걸리 6%,경복궁쌀로 빚은 서울의 1호 지역특산주
모을동주 약주,철원 오대쌀로 빚은 쌀내음 가득한 약주
나루 생막걸리 11.5%,경복궁쌀로 빚은 서울의 1호 지역특산주
모을동주 소주,철원 오대쌀로 빚은 쌀내음 가득한 소주
편백숲 산소막걸리,피톤치드 향내음 가득한 축령산 편백숲에서 찾아온 산소같은 막걸리
걍즐겨,과실의 산미와 쌀의 단맛이 어우러진 신개념 막걸리
뉴트로,"페일에일, IPA 맥주같은 드라이한 막걸리"
두유노,내추럴 와인같은 향에 산미와 단맛이 매력적인 막걸리
볼빨간막걸리 7,두근두근 수줍은 마음에 볼이 빨개지던 첫사랑의 느낌
볼빨간막걸리 10,두근두근 수줍은 마음에 볼이 빨개지던 첫사랑의 느낌
라이스퐁당 13,설렘 가득한 달콤한 인생술
라이스퐁당 17,설렘 가득한 달콤한 인생술
마주 소곡주,천오백년의 맛과 향이 백일의 정성에 담기다
햇찹쌀이 하늘수,100년을 바라보는 유서 깊은 양조장에서 빚은 술
설련주,눈처럼 하얀 백련꽃 향이 그윽한 술
홍로,지초의 붉은색이 눈길을 사로잡고 은은한 백련꽃 향은 마음을 사로잡는다.
산내울 사과애주,맑고 상큼한 사과의 싱그러움이 입안 가득
티나(TINA),딸기와 죽력으로 명인이 만든 파티용 젊은 전통주
르깔롱,"멜론, 코코넛, 죽력으로 명인이 만든 클럽용 젊은 전통주"
담양 죽력고,대나무의 고장 담양에서 명인이 빚은 죽력고
느낌 19.8,전통 안동소주를 현대적으로 재해석한 증류식소주
느낌 30,전통 안동소주를 현대적으로 재해석한 증류식소주
필 FEEL,전통 안동소주를 현대적으로 재해석한 증류식소주
안양 동동주,100년을 바라보는 유서 깊은 양조장에서 빚은 술
산내울 오미자주,2019년 대한민국 우리술품평회 기타주류부문 최우수상 수상
산내울 복분자주,"과일향, 꽃향, 나무향이 잘 어우러진 그윽한 술"
독산 53,상압증류로 정성껏 내린 전통 쌀 소주
맑은내일 발효막걸리,"부드럽고 깊은 향, 유산균이 빚어낸 오묘한 맛의 프리미엄 막걸리"
창원 생탁주,"부드럽고 깊은 향, 유산균이 빚어낸 오묘한 맛의 프리미엄 막걸리"
율무 동동주,연천 율무로 빚은 진한 맛 그대로 진땡이 막걸리
맑은내일 우포,2008년 환경올림픽 람사르총회 공식 건배주
연천 연주,그리운 연인처럼 향기로운 드라이한 맑은술
조선주조사,75여년의 응축된 양조기술로 빚은 맑은 청주
연천 우주,
동학 1957,2018 평창 동계올림픽 공식 판매주
천등산 차례주,국내산 쌀로 빚은 정성 가득 담긴 차례주
충주 백주,천등산 맥반암반수와 100% 국내산쌀로 빚은 증류주
삼양춘 청주,2018년 대한민국 주류대상 약주 부문 BEST OF BEST 수상
1000억 막걸리 프리바이오,
1000억 유산균막걸리,장까지 살아있는 식물성 유산균을 1000억마리 이상 키워낸 막걸리
술공방 9.0 생막걸리,인공첨가물 없이 빚은 자연주의 수제막걸리
구기홍주 14,진도의 특산주 진도홍주를 가볍고 부드럽게 재해석한 약주
겨울소주 25,은은한 곡물향이 매력적인 깔끔한 증류식소주
오산막걸리,인공첨가물 없이 빚은 자연주의 수제막걸리
오매백주,인공첨가물 없이 빚은 자연주의 수제막걸리
머르드 서 스위트,감악산 산머루로 빚은 프리미엄 머루와인
감악산 머루주,감악산 산머루로 빚은 프리미엄 머루주
도로시 머루주,감악산 산머루로 빚은 프리미엄 머루주
진맥소주 22%,100% 유기농 통밀로 빚은 전통수제방식의 프리미엄 소주
마주 소곡화주,천오백년의 맛과 향이 백일의 정성에 담기다
진맥소주 40%,100% 유기농 통밀로 빚은 전통수제방식의 프리미엄 소주
희양산막걸리 9%,우렁이농법으로 재배한 희양산 쌀로 빚은 수제 막걸리
진맥소주 53%,100% 유기농 통밀로 빚은 전통수제방식의 프리미엄 소주
희양산막걸리 15%,우렁이농법으로 재배한 희양산 쌀로 빚은 수제 막걸리
주산지 막걸리,경북 청송을 대표하는 80여 년 역사의 양조장에서 빚은 막걸리
청송 주왕 사과막걸리,경북 청송을 대표하는 80여 년 역사의 양조장에서 빚은 막걸리
청송 얼음골 동동주,경북 청송을 대표하는 80여 년 역사의 양조장에서 빚은 막걸리
도깨비술 7%,
도깨비술 9%,
도깨비술 11%,
연천 아주,"함박꽃향과 쌉싸름한 맛, 임진강이 빚은 프리미엄 생 막걸리"
편백숲 산소막걸리 순수령,청정한 숲 속 산소처럼 순수한 무첨가 막걸리
편백숲 산소막걸리 딸기스파클링,상큼한 딸기맛과 향이 가득 담긴 경쾌한 스파클링 막걸리
장수 오미자주,오미자의 5가지 맛이 어우러진 과실주
머르드 서 드라이,감악산 산머루로 빚은 프리미엄 머루와인
호땅,호두향과 땅콩맛이 어우러진 풍미 가득한 술
대대포 생막걸리,2020년 대한민국 우리술품평회 탁주부문 대상 수상
봉하쌀 생막걸리,친환경농업의 결실 봉화쌀로 빚은 막걸리
죽향 생막걸리,"댓잎을 스치는 바람, 이슬 닮은 전통의 맛"
대잎 생동동주,국내산 쌀로 빚고 몸에 좋은 영지버섯이 첨가된 술
천년담주,담양 지명 천년의 역사를 담은 약주
세종대왕어주 약주,2019년 대한민국 우리술품평회 대통령상 수상
세종대왕어주 탁주,세종대왕의 어의가 저술한 고문헌 속 술을 재현한 프리미엄 막걸리
유기농 이도14,2019년 대한민국 우리술품평회 약청주부문 최우수상 수상
우곡생주,2019 대한민국 우리술품평회 탁주 부문 대상 수상
마셔블랑,제주 한라봉으로 만든 화이트 와인
귀감,참나무통에서 숙성한 제주 감귤 소주
설하담,
풍남문,보리로 만든 프리미엄 수제 발포주
남산애 포트와인,"일체의 첨가물, 보존제도 없는 자연주의 와인"
복숭아와인,은은하고 달콤한 복숭아 풍미가 가득한 와인
오가피와인,오크통에 숙성한 듯한 향과 묵직한 바디감
사과와인,새콤달콤한 사과의 풍미가 가득한 와인
혼디주,제주 감귤로 빚은 싱그러운 맛과 향이 담긴 과실주
신례명주,제주 감귤로 빚은 맛과 향이 뛰어난 브랜디
영일만친구 막걸리,포항을 대표하는 포항쌀로 빚은 막걸리
도구 막걸리,포항에서 출시된 가장 오래된 막걸리
동해 동동주,포항 최초로 100% 쌀로 만든 막걸리
남산애 레드와인,"일체의 첨가물, 보존제도 없는 자연주의 와인"
가을빛 레드와인,"일체의 첨가물, 보존제도 없는 자연주의 와인"
백년향,삼양주기법으로 백일동안 정성껏 빚은 술
여강,경기 여주쌀로 빚은 순곡 증류주
삼선,"천(天), 지(地), 인(人)의 기운을 담아는 삼선 탁주"
애석,맛과 향이 뛰어나 감히 삼키지 아깝다는 석탄주를 재현한 술
메밀로,강원도 홍천 쌀과 메밀로 빚어 증류한 프리미엄 증류주
기다림 25,
기다림 34,
기다림 맑은술,"100일간의 기다림으로 탄생한 프리미엄 막걸리, 기다림 34"
경기전,보리로 만든 프리미엄 수제 발포주
오목대,보리로 만든 프리미엄 수제 발포주
정고집 옛날 생동동주,"쌀알이 동동, 60년 장인정신으로 빚은 동동주"
정고집 나주쌀 생막걸리,은은한 과일 향과 원재료의 깊은 맛을 품은 막걸리
정고집 나주배 약주 9%,나주의 특산품 나주배로 만든 황금빛 약주
정고집 나주배 약주 15%,나주의 특산품 나주배로 만든 황금빛 약주
기다림 16,
두리향,"맛과 향이 너무 좋아 차마 삼키기가 안타까운 술, 석탄주를 증류한 술"
막시모40,친환경 오미자를 원료로 만든 오미자 증류주
예천주 사월24,친환경 오미자를 원료로 만든 오미자 증류주
예천주 사월365,친환경 오미자를 원료로 만든 오미자 증류주
예천주복 만월40,선명하고 풍성하게 복분자향이 퍼지는 복분자 증류주
병영설성사또,"햅쌀과 오디, 복분자가 만나 탄생한 명주"
해방주 18.8%,영덕의 특산물 해방풍으로 빚은 증류주
송화백일주,대한민국 식품명인 제1호로 지정된 사찰에서 빚은 명주
황금보리소주17,국내 최초로 황금보리로 만든 깔끔한 증류주
황금보리소주25,국내 최초로 황금보리로 만든 깔끔한 증류주
황금보리소주40,국내 최초로 황금보리로 만든 깔끔한 증류주
예밀와인 레드 스위트,강원도 영월의 자연을 그대로 담은 달콤한 한국와인
예밀와인 로제,2018 광명동굴 대한민국와인품평회 은상 수상
병영설성 생막걸리,식품명인이 우리 쌀로 정직하게 빚은 막걸리
병영설성 동동주,식품명인이 우리쌀로 정직하게 빚은 동동주
시나브로 레드 드라이,나도 모르게 시나브로 반하게 만드는 매력적인 와인
시나브로 레드 스위트,나도 모르게 시나브로 반하게 만드는 매력적인 와인
시나브로 에뚜왈 스파클링와인,나도 모르게 시나브로 반하게 만드는 매력적인 와인
시나브로 드 글로리아,나도 모르게 시나브로 반하게 만드는 매력적인 와인
그랑티그르CE2002,"한국와인 기대주, 월류원이 만든 프리미엄 와인"
그랑티그르M1988,포도와 오미자를 브랜딩한 프리미엄 와인
예밀와인 레드 드라이,2019 대한민국주류대상 한국와인부문 대상 수상
샤토미소 랑,청포도의 싱그러움이 가득 담긴 화이트화인
샤토미소 레드 프리미엄 드라이,한국와인대상 3개년 수상에 빛나는 프리미엄 와인
샤토미소 영동,품질 좋은 도란원의 와인을 증류하여 만든 브랜디
가덕 순쌀 막걸리,충북 청원쌀과 백족산 맑은 물로 정성껏 빚은 막걸리
청남대 블루베리 막걸리,충북 청원쌀과 백족산 맑은 물로 정성껏 빚은 막걸리
매실향기 담은 술,새콤달콤한 맛으로 건강하게 마시는 술
한시울,새콤달콤한 맛으로 건강하게 마시는 술
이상헌 탁주,세상 어디에도 없는 알코올 19% 탁주
이상헌 약주,"어떠한 첨가물 없이 쌀, 누룩, 물로만 빚은 순수한 약주"
예천주복 만월24,선명하고 풍성하게 복분자향이 퍼지는 복분자 증류주
순향주,오양주기법으로 정성껏 빚은 프리미엄 약주
술헤는밤,부담없이 마시기 좋은 수제 막걸리
감 보드카,
감이슬,감의 고장 논산 양촌의 감으로 빚은 감 증류주
하향주,대구시 무형문화재 11호 기능보유자가 빚은 프리미엄 약주
하향주 증류주,대구시 무형문화재 11호 하향주를 증류한 프리미엄 증류주
어우야,"기다림의 미학, 45일의 자연 발효로 빚은 술"
흑돈주,"기다림의 미학, 45일의 자연 발효로 빚은 술"
황칠주,"기다림의 미학, 45일의 자연발효로 빚은 술"
해파랑,영덕의 특산물 해방풍으로 빚은 약주
해방주 38%,영덕의 특산물 해방풍으로 빚은 증류주
천년주,신이 내린 약초 천년초로 빚은 증류주
해미읍성 딸기와인,다양한 과실주를 빚는 세인트하우스 와이너리의 딸기와인
해미읍성 매실와인,다양한 과실주를 빚는 세인트하우스 와이너리의 매실와인
해미읍성 살구와인,다양한 과실주를 빚는 세인트하우스 와이너리의 살구와인
해미읍성 모과와인,다양한 과실주를 빚는 세인트하우스 와이너리의 모과와인
맑은술 해밀,40여년 전통주를 빚어온 술도가에서 선보이는 프리미엄 약주
레돔 내추럴 스파클링 로제와인,프랑스 농부가 한국에서 만든 자연주의 와인
레돔 시드르,프랑스 농부가 한국에서 만든 내추럴 애플 시드르
감자술 13%,강원도 감자바우로 빚은 평창 감자술
서주 16%,강원도 감자바우로 빚은 평창 감자술의 프리미엄 제품
추시와인,감의 고장 논산 양촌의 감으로 빚은 감와인
원조 한산소곡주,천오백년의 맛과 향이 백일의 정성에 담기다
석탄주 약주,맛과 향이 너무 좋아 차마 삼키기가 안타까운 술
원조 소곡화주,불소곡주라고도 불리는 한산소곡주 증류주
방문주 탁주,"술 빚는 방법대로 빚은 술, 방문주"
크라테 레드와인 스위트,해발 1317m 청정지역 산머루와 포도로 빚은 와인
방문주 약주,"술 빚는 방법대로 빚은 술, 방문주"
크라테 레드와인 드라이,해발 1317m 청정지역 산머루와 포도로 빚은 와인
크라테 로제와인,해발 1317m 청정지역 산머루와 포도로 빚은 와인
선운산 복분자주,2018년 대한민국 우리술품평회 과실주 부문 우수상 수상
선운산 복분자와인,24년간 복분자주 생산으로 축적된 발효숙성공법으로 빚은 술
선운산 복분자주 프리미엄,24년간 복분자주 생산으로 축적된 발효숙성공법으로 빚은 술
샹스프랑보아즈,24년간 복분자주 생산으로 축적된 발효숙성공법으로 빚은 정통 복분자와인
산정호수 동정춘막걸리,2018 대한민국 우리술품평회 탁주 부문 대상 수상
허니문와인,대한민국 최초로 상용화에 성공한 벌꿀 발효주
배꽃담은 연 생막걸리,2018 대한민국 우리술품평회 탁주 부문 우수상 수상
석탄주 탁주,맛과 향이 너무 좋아 차마 삼키기가 안타까운 술
천비향 오양주 약주,전통방식 그대로 쌀과 누룩으로만 빚은 프리미엄 약주
천비향 오양주 탁주,전통방식 그대로 쌀과 누룩으로만 빚은 프리미엄 막걸리
청진주,"쌀과 누룩, 그리고 물만으로 빚은 진주처럼 귀한 술"
아황주,고려시대 궁중에서 전해온 천년의 역사를 간직한 술
미인탁주,자연 그대로를 담아 빚어 낸 맛이 조화로운 막걸리
미인약주,자연 그대로를 담아 빚어 낸 맛이 조화로운 약주
삼양춘 생탁주,2018년 대한민국 주류대상 탁주부문 대상 수상
삼양춘 생약주,2018년 대한민국 주류대상 약주 부문 BEST OF BEST 수상
술그리다 생탁주,전통방식 그대로 쌀과 누룩으로만 빚은 프리미엄 막걸리
술예쁘다 생탁주,전통방식 그대로 쌀과 누룩으로만 빚은 프리미엄 막걸리
김포별주,금처럼 값진 술을 담다 전하다
김포 막걸리,김포 금쌀로 빚은 오랜 친구처럼 정겨운 막걸리
김포약주 유리병,금처럼 값진 술을 담다 전하다
김포약주 PET,금처럼 값진 술을 담다 전하다
천비향 화주,천비향 약주를 상압식 증류하여 만든 최상급 증류주
김포예주 프리미엄,금처럼 값진 술을 담다 전하다
백자주,강원도 홍천의 명품 잣이 듬뿍 들어간 프리미엄 탁주
석로주,석이버섯을 활용한 전통 수제 발효주
호모루덴스,홍천의 산속 계곡 양조장에서 빚은 드라이한 고급 탁주
동정춘,지난해 마셨던 동정춘의 향내가 아직도 손에서 난다
녹파주,
한주,로주두말빚이로 빚은 조선시대 명주
안성마춤 생막걸리,엄선된 안성마춤 햅쌀로 빚은 막걸리
선호 생막걸리,80여년 이어온 탁주의 명가에서 빚다
미생 막걸리,80여년 이어온 탁주의 명가에서 빚다
김포특주,80여년 이어온 전통주 명가에서 빚은 특별한 술
죽력고,4대에 걸쳐 130여년 동안 전승된 문화재급 전통주
송명섭 막걸리,막걸리 마니아들이 손꼽는 드라이한 막걸리 '송막'
면천두견주 360,남북정상회담 만찬주로 선정된 중요 무형문화재
면천두견주 700,남북정상회담 만찬주로 선정된 국가무형문화재
술아 연화주,여름의 연꽃과 잎을 넣어 신선하고 맑은 맛이 일품
술아 국화주,가을 국화를 넣어 꼬 끝에 스치는 향이 일품
면천두견주 900,남북정상회담 만찬주로 선정된 중요 무형문화재
술아 매화주,봄의 매화를 넣어 은은한 향이 일품
추사 로제,사과와인의 명가에서 만드는 장미빛 사과와인
추사40,사과와인 명가에서 만든 사과증류주
술아 순곡주,"겨울, 여주산 찹쌀로 빚은 순수하고 깨끗한 순곡주"
술아 막걸리,"쌀, 누룩, 물만으로 빚은 100% 수제 막걸리"
오희 스파클링 막걸리,오미자가 전하는 부드러움과 싱그러운 맛의 조화
애피소드 호프,사과와인과 맥주가 만나 새로운 미각을 자극한다
The 찾을수록 시리즈,와이너리에서 만든 이색적인 사과소주
뱅꼬레 레드와인,35년 와인메이커 외길인생의 역작
왕피천을 품은 미소생막걸리,"천년의 울진, 백년의 술도가"
미소 생막걸리,"천년의 울진, 백년의 술도가"
오메기 맑은술,제주의 풍미가 가득 담긴 제주 대표술
뱅꼬레 화이트와인,35년 와인메이커 외길인생의 역작
뱅꼬레 로제와인,35년 와인메이커 외길인생의 역작
스타베리 오디와인,국산 친환경 오디로 빚은 정통발효와인
뱅꼬레 아이스와인,35년 와인메이커 외길인생의 역작
청명주 500,충청북도 무형문화재 지정
아이원 막걸리,"시인의 마을, 장인의 양조장에서 빚다"
애피소드 상그리아,한국와인의 명가에서 만든 상그리아
애피소드 애플,명품 의성사과로 만든 탄산와인
한스오차드 사과와인,명품 의성사과로 옹기에서 숙성한 사과와인
청산녹수 생탁주,막걸리 본연의 맛에 충실한 생생한 막걸리
청산녹수 꿀막걸리,천연벌꿀로 후숙한 달콤하고 부드러운 막걸리
청산녹수 사미인주,발효과학과 전통기법이 만나 탄생한 명품 막걸리
향수 우리밀 막걸리,"시인의 마을, 장인의 양조장에서 빚다"
시인의 마을 우리쌀 막걸리,"시인의 마을, 장인의 양조장에서 빚다"
청명주 750,충청북도 무형문화재 지정
이화백주,청량한 탄산과 달콤새콤한 풍미가 매력적인 탁주
감그린 아이스와인,경북 청도의 씨 없는 감의 특별한 변신
왕율주,공주밤과 공주쌀로 빚은 대한민국 최초 밤 증류주
밤꽃향기,공주밤과 공주쌀로 빚은 맑은 술
강소주,
감그린 스페셜,경북 청도의 씨 없는 감의 특별한 변신
감그린 레귤러,경북 청도의 씨 없는 감의 특별한 변신
진쾌남,공주밤과 공주쌀로 빚은 대한민국 최초 밤 증류주
공주애 오디와인,공주 오디로 빚은 향긋하고 달콤한 과실주
도문대작 생막걸리,강릉 5대 명주 중 하나인 방풍주를 복원하다
계룡산 산삼주 금수강산 40%,전설의 약초 산삼과 계룡산 맑은 물로 빚은 산삼주
한비 무병장수술,아홉 가지 건강 약재가 함유된 기능성 전통주
한비 동충하초술,동충하초와 오가피가 담긴 고급 리큐르
한비 오가피술,10년산 친환경 오가피가 첨가된 리큐르
한비 쌀소주,전통기법으로 빚은 순하고 부드러운 소주
고창선운산 땡큐블루베리주,고창 블루베리로 빚은 명품 블루베리주
송이주,산림욕을 하는듯한 싱그러움과 담백한 맛
화주,화주 한잔에 풍미와 기품을 담다
계룡산 산삼주 금수강산 21%,전설의 약초 산삼과 계룡산 맑은 물로 빚은 산삼주
능이주,본초강목에서 전하는 귀한 능이버섯으로 빚은 약주
고운달 백자,문경 오미자로 빚은 프리미엄 증류주
문경바람 백자 40%,문경 사과로 빚은 풍미 가득한 사과증류주
문경바람 오크,문경 사과로 빚은 풍미 가득한 사과증류주
오미로제 프리미어와인,문경 오미자로 빚은 오미자 스틸와인
문경바람 백자 25%,문경 사과로 빚은 풍미 가득한 사과증류주
원매,국내 유일하게 황매실 100%로 담근 프리미엄 매실주
서울의 밤,
고창선운산 땡큐복분자주,고창 복분자로 빚은 명품 복분자주
고창선운산 복분자주 특1호,고창 복분자로 빚은 명품 복분자주
쿨샷7.5,55알의 햇복분자를 한병에 담다
니모메,청정 제주의 자연을 오롯이 담은 싱그러운 술
월매 쌀막걸리,2017년 대한민국 우리술품평회 우수상 수상
호담 산양산삼 막걸리,2017년 대한민국 우리술품평회 대통령상 수상
제주 고소리술,제주특별자치도 무형문화재 제11호
고도리 화이트와인 드라이,GAP인증 거봉 포도로 만든 신의 물방울
고도리 레드와인 스위트,GAP인증 머루포도로 만든 신의 물방울
세우리,청정 제주의 자연을 오롯이 담은 정성
고도리 화이트와인 스위트,GAP인증 거봉 포도로 만든 신의 물방울
고도리 복숭아와인,GAP인증 복숭아로 만든 디저트와인
고운달 오크,문경 오미자로 빚은 프리미엄 증류주
야관문 쌀 막걸리,밤에 빗장문을 열어주는 약초로 빚은 막걸리
지리산 정담 생쌀 막걸리,"함께 나누면 더욱 정다운, 정담 막걸리"
지리산 허브잎 술,대한민국 우리술품평회 2개년 대상 수상
호담 300ml,2014 대한민국 우리술품평회 수상
명술 375ml,2014 대한민국 우리술품평회 수상
호담 산양산삼주,대한민국 우리술품평회 2년 연속 대상 수상
다래와인 7004D,참다래와 빚은 독특고 맛있는 한국와인
다래와인 7004S,참다래와 빚은 독특고 맛있는 한국와인
다래와인 3004,참다래로 빚은 독특고 맛있는 한국와인
풍정사계 동(冬),"겨울에 마시는 귀한 술, 풍정사계 소주"
풍정사계 추(秋),"가을에 마시는 맛있는 술, 풍정사계 탁주"
풍정사계 하(夏),"여름에 마시는 향기로운 술, 풍정사계 과하주"
